Title,Note,Comment
Santa Severa,Neighbourhood,A seaside town near Rome known for its castle and beach.
Ostia,Neighbourhood,A large archaeological site and ancient port city located near Rome.
Neighbourhood Monti,Neighbourhood,"A charming and trendy neighbourhood known for its boutiques, bars and restaurants."
Trastevere,Neighbourhood,"A vibrant neighbourhood with narrow streets, lively squares, and a wide selection of restaurants and bars."
Pizzeria Baffetto,Restaurant,A historic pizzeria in Rome known for its delicious thin-crust pizzas.
Colosseo,Monument,Ancient amphitheatre in the centre of Rome.
Piazza d'espagna,Monument,"A beautiful and iconic square in Rome, known for its Spanish Steps and beautiful fountain."
Vecchia Roma,Restaurant,Great restaurant.